blogpost_id,url,user,date,text,sentiment,toxicity
35,https://buffalochronicle.com/2019/03/06/deep-and-penetrating-relationship-may-taint-butts-testimony/,2,3/7/19 17:45,Thats why the past politicians legalized same sex lowered the age of consent so that their children could walk carefree through a country with no values no dicipline Anything goes Even tho they are now genderless they are not breaking any laws only values that the world has lived by since the beginning of time They can say there is no God but when their time on earth is finished they will stand naked before God They can deny all they want but they will know the truth in the end They may think they have no one to be accountable to It will be a moment of truth The blood of Canadian people that have died because of their selfish decisions they have made will be on their hands as evidence of their selfish useless lives They dont have a con science This is the genderless society they are convicts of science conscience The curse will follow their generations until the curse has been broken in each generation for four years,-0.26875,0.43178353
35,https://buffalochronicle.com/2019/03/06/deep-and-penetrating-relationship-may-taint-butts-testimony/,2,3/8/19 0:07,You are insane,-1,0.832356
35,https://buffalochronicle.com/2019/03/06/deep-and-penetrating-relationship-may-taint-butts-testimony/,2,3/8/19 14:09,What a complete moron,-0.35,0.9501479
35,https://buffalochronicle.com/2019/03/06/deep-and-penetrating-relationship-may-taint-butts-testimony/,59,3/8/19 16:06,How do you know you will stand before God naked Have you been there before Politicians needs to learn what is truth and what is denial You cant learn that in schools must be learned at home It seems a lot of no color skin parents failed in that department Hoka,-0.390625,0.4960586
35,https://buffalochronicle.com/2019/03/06/deep-and-penetrating-relationship-may-taint-butts-testimony/,55,3/8/19 18:34,oh leave religion out of it for petes sake,0,0.22402231
35,https://buffalochronicle.com/2019/03/06/deep-and-penetrating-relationship-may-taint-butts-testimony/,2,3/20/19 18:55,amen,0,0.066171825
35,https://buffalochronicle.com/2019/03/06/deep-and-penetrating-relationship-may-taint-butts-testimony/,60,3/6/19 21:18,Zero Point Energy is working Trudeau knows all about it Why dont you httpsufodigestcomarticlejustintrudeau1221,0,0.18061835
35,https://buffalochronicle.com/2019/03/06/deep-and-penetrating-relationship-may-taint-butts-testimony/,61,3/6/19 22:03,Its also no surprise that Butts would refuse to testify under oath he wanted to be able to get away with lying Nor was it a surprise that the caucus would strike down a perfectly reasonable proposition simply on account of the party that proposed it,0.136111,0.33027378
35,https://buffalochronicle.com/2019/03/06/deep-and-penetrating-relationship-may-taint-butts-testimony/,62,3/6/19 23:10,ANYONE who testifies MUST do so under oath If not under oath then ANYTHING they say MUST be considered BULLSHIT Especially if taking an oath is REFUSED Think people Think Butts is a flimflam assbandit Hes come to take your money your freedom your faith your trust your future your familys future and anything else he can take Hes still working with Hotsox Hes just not being paid for directly ahem presently by the PMO He said he spent the last while since resigning going through his texts etc He has NO RIGHT to have access to those as once no longer employed by the PMO his devices and access to the data were to be disallowed Yet he has access maybe a friend gave him a secret pass hmm My GREAT fear is that this SNC bullshit is simply a smokescreen for something MUCH MUCH bigger going on with the UN Soros Bildeberg etc Any hackers out there Ill pay you to dig,0.021429,0.66553557
35,https://buffalochronicle.com/2019/03/06/deep-and-penetrating-relationship-may-taint-butts-testimony/,63,3/7/19 6:50,They all took the oath when sworn into office Does that mean nothing Why bother then its a waste money and again,-0.25625,0.36263436
35,https://buffalochronicle.com/2019/03/06/deep-and-penetrating-relationship-may-taint-butts-testimony/,2,3/7/19 12:13,Butts didnt as he was an employee not voted in so he doesnt have to,0,0.43990642
35,https://buffalochronicle.com/2019/03/06/deep-and-penetrating-relationship-may-taint-butts-testimony/,38,3/8/19 15:20,Who wrote this,0,0.047861483
35,https://buffalochronicle.com/2019/03/06/deep-and-penetrating-relationship-may-taint-butts-testimony/,2,3/13/19 17:27,Who wrote this article,0,0.038206793
35,https://buffalochronicle.com/2019/03/06/deep-and-penetrating-relationship-may-taint-butts-testimony/,64,3/17/19 14:06,I am sure these two guys have penetrated each other,0.1875,0.68745756
35,https://buffalochronicle.com/2019/03/06/deep-and-penetrating-relationship-may-taint-butts-testimony/,2,1/5/20 18:22,I am not at all shocked have many questions myself,-0.1,0.051647916
29,https://buffalochronicle.com/2019/03/11/political-grandmaster-frank-iacobucci-is-at-the-center-of-snc-lavalin-kinder-morgan-scandals/,65,3/12/19 7:02,Wow As a Canadian personkind Im embarrased to say I havent seen ANYTHING this good in any of our generally pathetic JustinJourno BoughtMedia Canadian LSM I mean you dont expect nything meaningful in the Red Star or the CBC of course but still Loved the LavScam list of lobbying at the end of the article showing the Laurentian Elite selffellating Former Supreme and NoShrinkingViolet Wacobucci makes an excellent pimp for this,0.190278,0.53577846
29,https://buffalochronicle.com/2019/03/11/political-grandmaster-frank-iacobucci-is-at-the-center-of-snc-lavalin-kinder-morgan-scandals/,66,3/15/19 15:23,Agreed a remarkably insightful piece that should have been authored by someone in our country Canada Thank you,0.9375,0.034509655
29,https://buffalochronicle.com/2019/03/11/political-grandmaster-frank-iacobucci-is-at-the-center-of-snc-lavalin-kinder-morgan-scandals/,8,3/15/19 17:26,I am sure that someone from Canada did write it Wonder why published in US risk of attack by someone for libel,0.5,0.2054916
29,https://buffalochronicle.com/2019/03/11/political-grandmaster-frank-iacobucci-is-at-the-center-of-snc-lavalin-kinder-morgan-scandals/,67,3/23/19 15:51,No media has discussed Gywn Morgan In the Scandal he was the Director in 2011 when all the law breaking occured He was also best friend of PM Harper Just a farm boy from Alberta but still a kingpin Please if you write a story about this in the US at least do some research The minute the story broke Morgan resigned and isnt mentioned anywhere as architect of the whole Libyan mess,0.18125,0.11469748
29,https://buffalochronicle.com/2019/03/11/political-grandmaster-frank-iacobucci-is-at-the-center-of-snc-lavalin-kinder-morgan-scandals/,68,3/24/19 11:01,Nice try at deflection LIEBrawl,0.6,0.27769834
29,https://buffalochronicle.com/2019/03/11/political-grandmaster-frank-iacobucci-is-at-the-center-of-snc-lavalin-kinder-morgan-scandals/,69,3/12/19 14:43,Very interesting piece Why is there no byline Who wrote it It is hard to tell if this is credible without seeing what else the author has written,0.252778,0.065990426
29,https://buffalochronicle.com/2019/03/11/political-grandmaster-frank-iacobucci-is-at-the-center-of-snc-lavalin-kinder-morgan-scandals/,70,3/12/19 22:42,perhaps Iacobucci Trudeau Butts and Wernick can all share a cell together would be fun to see a former SC judge get jailed,0.15,0.40201062
29,https://buffalochronicle.com/2019/03/11/political-grandmaster-frank-iacobucci-is-at-the-center-of-snc-lavalin-kinder-morgan-scandals/,2,3/13/19 21:10,SNCLavalin wants to build the Kinder Morgan pipeline to secure an energy supply chain to India for the sake of the Commonwealth India is too dependent on OPEC and this puts all of Southeast Asia at risk of communism or something This holy mission from the Queen justifies the federal governments purchase of the pipeline which SNCLavalin lobbyists negotiated with the assistance of diplomats The DPA agreement is absolutely necessary now because SNCLavalin needs to be eligible to accept federal contracts to build it And theres nobody else They are the ones with the expertise in First Nations bribing theyre already hard at work on that thanks Frank India thinks KM is dying in the courts so shit all over Trudeau during his trip which seemed decadent and clueless to the BJP Jody WilsonRaybould has no idea any of this is happening when she independently decides theres no way they are getting a DPA But everyone assumes that native bitch from BC is pulling the NO PIPELINES ON STOLEN NATIVE LAND routine that party elders predicted was all she was good for Everyone begs her to reconsider but cant really explain why its so important Scott Brison decides this house of cards is not worth the risk to his postpolitical career and gets the fuck out of there when he smells smoke coming from the Attorney Generals office David Lametti is shuffled into the job because as parliamentary secretary to Freeland and Bains hes in the know on pipeline Plan B Trudeau threatens WilsonRaybould with Aboriginal Affairs because he wants to know if this refusal to defer prosecution was a power grab hes making a joke that everything is Indian Affairs to her anyway and he is anticipating that ruthless and unapologetic as she is she will take it to further her agenda even if he means it as an insult He is shocked when she doesnt and they improvise with Veteran Services which they are doubly shocked she accepts She is clueless and stubborn not sabotaging the pipeline OReagan to Aboriginal Affairs is her punishment for not playing along Its imposed collectively because all natives share the blame apparently Its Jane Philpott to Treasury Board that ruins everything for Trudeau What a blind spot he has for women She gets the briefing on the KM pipeline 20 shit parade that Brison got that sent him packing and she realizes this is why Jody WilsonRaybould has lost her job they misread her intentions they didnt think she was being legalistic they thought she was knowingly sabotaging Trudeaus agenda for personal reasons She got in the way of the pipeline Philpott tells her what is going on WilsonRaybould finally given a glimpse of the depth of the pit she is in makes an escape plan and executes it Philpott realizes that she was exposed on this leak and her career in politics is over because she is going to be blamed for the Globe and Mail leak as well so she resigns without regrets Thats why JWR is staying gagged on what happened while she was at Veterans Affairs Thats why the ethics commissioner got too sick to investigate Thats why the PMO cant make any sense of what is going on and why the PM wont explain anything Its a conspiracy,-0.099466,0.61835575
29,https://buffalochronicle.com/2019/03/11/political-grandmaster-frank-iacobucci-is-at-the-center-of-snc-lavalin-kinder-morgan-scandals/,71,3/15/19 19:57,Anonymous that explains why there was no negotiating on the cost of the old and new KM pipeline more than 11 billion was given to KM for the purchase The whore media dont report fact It certainly clarifies why Iacobucci is busy giving away money in BC If we could only clean out the collectivists and leave govt to just police law courts and soldiers the world would be a better place Thanks for the hypothesis its revealing,0.235257,0.5537882
29,https://buffalochronicle.com/2019/03/11/political-grandmaster-frank-iacobucci-is-at-the-center-of-snc-lavalin-kinder-morgan-scandals/,2,6/2/19 12:56,Anonymous All you need to do now is reveal SNCLAVALINs Role in The Mayerthorpe Massacre re Northern Gateway Pipeline And youll be on your way to A Pulitzer,0,0.20732696
29,https://buffalochronicle.com/2019/03/11/political-grandmaster-frank-iacobucci-is-at-the-center-of-snc-lavalin-kinder-morgan-scandals/,72,3/14/19 13:36,Among Torontoarea political operatives its been rumored that Iacobucci may be one of three men in possession of embarrassing information on Trudeau I have heard from someone I consider to be very reliable that Trudeau had an affair with one of his students when he was teaching in Vancouver The parents didnt want a public scandal The school gave Trudeau the option of resigning or having a hearing he chose to resign from teaching I wonder if this is the embarrassing information Trudeau the groper is so narcissistic that I wouldnt be surprised,0.075,0.39459908
29,https://buffalochronicle.com/2019/03/11/political-grandmaster-frank-iacobucci-is-at-the-center-of-snc-lavalin-kinder-morgan-scandals/,73,3/14/19 15:31,Its Jane Philpott to Treasury Board that ruins everything for Trudeau What a blind spot he has for women She gets the briefing on the KM pipeline 20 shit parade that Brison got that sent him packing Yes also consider she may have had talks with those who worked with Brison,-0.275,0.7057212
29,https://buffalochronicle.com/2019/03/11/political-grandmaster-frank-iacobucci-is-at-the-center-of-snc-lavalin-kinder-morgan-scandals/,73,3/14/19 15:47,I dont believe SNC has a special interest in supplying India with oil Instead consider that Trudeau wanted the pipeline which could only be build if Quebecs SNC got to build it,0.178571,0.06580701
29,https://buffalochronicle.com/2019/03/11/political-grandmaster-frank-iacobucci-is-at-the-center-of-snc-lavalin-kinder-morgan-scandals/,74,3/26/19 23:04,So was the delay in approving the pipeline fabricated to wait until SNCs DPA was cleared so they could subsequently qualify to win the contract to build the KM pipeline,0.266667,0.038006254
29,https://buffalochronicle.com/2019/03/11/political-grandmaster-frank-iacobucci-is-at-the-center-of-snc-lavalin-kinder-morgan-scandals/,75,3/15/19 3:18,British Columbias indigenous people have never ceded their lands to Canada by Treaty or transaction  So I would presume the BC North American Tribal People have signed documentation from the people they took the lands from NO OHHH you mean they STOLE It,-0.104167,0.3420869
29,https://buffalochronicle.com/2019/03/11/political-grandmaster-frank-iacobucci-is-at-the-center-of-snc-lavalin-kinder-morgan-scandals/,76,3/15/19 18:17,British Columbias indigenous people have never ceded their lands to Canada by Treaty or transaction  This is bullshit The northeast corner of BC is ceded treaty land Treaty 8 to be specific Much of southern Vancouver Island is also ceded treaty land Douglas Treaty Neither the Crown or the Natives want the treaties to be valid for various reasons but the courts consistently uphold their validity The pipelines will pass mostly through nontreaty land sure but the treaties do exist Makes me wonder what else is bullshit in this story,0.178571,0.57031745
29,https://buffalochronicle.com/2019/03/11/political-grandmaster-frank-iacobucci-is-at-the-center-of-snc-lavalin-kinder-morgan-scandals/,2,3/22/19 6:23,I guess it would sound like bullshit when you only quote PART of the sentence why are you trying to mislead people Makes me think this story is right on point,0.228571,0.7143426
29,https://buffalochronicle.com/2019/03/11/political-grandmaster-frank-iacobucci-is-at-the-center-of-snc-lavalin-kinder-morgan-scandals/,2,3/20/19 18:40,When Michael Wernick spoke about a real fear of somebody getting killed during the next federal election was he hinting that the liberal party is capable of this Also Scott Brison sure has cum on his face,0.14,0.71047646
30,https://buffalochronicle.com/2019/03/16/at-trudeaus-behest-gould-instructed-google-news-to-limit-canadian-access-to-foreign-press/,77,3/17/19 5:54,Thanks for this important reporting from a Canadian Keep up the good work,0.433333,0.08731047
30,https://buffalochronicle.com/2019/03/16/at-trudeaus-behest-gould-instructed-google-news-to-limit-canadian-access-to-foreign-press/,78,3/17/19 11:33,Reporting from a Canadian who wont put a name on what he or she writes isnt reporting its gossip at best and slander at worst Pathetic Tory horse puckey,-0.333333,0.5991294
30,https://buffalochronicle.com/2019/03/16/at-trudeaus-behest-gould-instructed-google-news-to-limit-canadian-access-to-foreign-press/,79,3/17/19 18:30,If it is true it is neither I believe all of it is true,0.35,0.056919094
30,https://buffalochronicle.com/2019/03/16/at-trudeaus-behest-gould-instructed-google-news-to-limit-canadian-access-to-foreign-press/,80,3/19/19 4:11,Oh I see Lornes Liberal butt is butt hurt seeing his boyfriend Justine involved in yet another scandal Lorne I cant believe you condone censorship of Canadians you should be ashamed of yourself and your Communist Party Lead by Justine Castro,0,0.6857572
30,https://buffalochronicle.com/2019/03/16/at-trudeaus-behest-gould-instructed-google-news-to-limit-canadian-access-to-foreign-press/,2,3/19/19 9:34,It was also reported by the Globe and Mail on March 4th so no,0,0.07360667
30,https://buffalochronicle.com/2019/03/16/at-trudeaus-behest-gould-instructed-google-news-to-limit-canadian-access-to-foreign-press/,81,3/19/19 10:37,Yet you believe a PM at his word that nothing happened when his own liberal party turned on him because of his antics This is exactly whats wrong with the Liberal party and its followers They have lost all ability to see fact and only care about their ideology Rather pathetic,-0.13,0.68895274
30,https://buffalochronicle.com/2019/03/16/at-trudeaus-behest-gould-instructed-google-news-to-limit-canadian-access-to-foreign-press/,82,3/20/19 10:28,Regardless of reported it what was said was factual and certainly doesnt make it any less valuable,0.02381,0.117785625
30,https://buffalochronicle.com/2019/03/16/at-trudeaus-behest-gould-instructed-google-news-to-limit-canadian-access-to-foreign-press/,83,4/9/19 21:14,Thank you for that Its unbelievably true Thats the scary part And it only scratches the surface of the deep state Canadiana style,-0.0375,0.04252337
30,https://buffalochronicle.com/2019/03/16/at-trudeaus-behest-gould-instructed-google-news-to-limit-canadian-access-to-foreign-press/,15,3/23/19 9:51,or  its the truth Either way Why has the news media in Canada dropped the SNC SCANDAL like a scalding hot potato  Money Advertising Govt grantsbribes Disgusting doesnt even begin to describe the Canuck mediathey drink eat others bath water Not to worry Trudeau is gone in the next election How do you like them SNC apples,-0.21875,0.44007388
30,https://buffalochronicle.com/2019/03/16/at-trudeaus-behest-gould-instructed-google-news-to-limit-canadian-access-to-foreign-press/,2,3/17/19 11:43,Whoever wrote this is illiterate,0,0.50410163
30,https://buffalochronicle.com/2019/03/16/at-trudeaus-behest-gould-instructed-google-news-to-limit-canadian-access-to-foreign-press/,84,3/17/19 14:30,Argumentum ad hominem is worse than stupid If you have evidence refute the article,-0.6,0.89432913
30,https://buffalochronicle.com/2019/03/16/at-trudeaus-behest-gould-instructed-google-news-to-limit-canadian-access-to-foreign-press/,85,10/8/19 15:34,Touche,0,0.2668416
30,https://buffalochronicle.com/2019/03/16/at-trudeaus-behest-gould-instructed-google-news-to-limit-canadian-access-to-foreign-press/,86,3/17/19 16:41,Unattributed reportage Unidentified Canadian Propaganda BS,-0.195312,0.49578422
30,https://buffalochronicle.com/2019/03/16/at-trudeaus-behest-gould-instructed-google-news-to-limit-canadian-access-to-foreign-press/,87,3/17/19 7:58,Thanks for giving us information we arent seeing north of the border,0.2,0.074104816
30,https://buffalochronicle.com/2019/03/16/at-trudeaus-behest-gould-instructed-google-news-to-limit-canadian-access-to-foreign-press/,88,3/17/19 8:47,Please keep me informed if my government believes Im not entitled to know about this stuff its not much of a government and more like children that got caught doing something they shouldnt have been doing Thank you for this information,0.2,0.08722202
30,https://buffalochronicle.com/2019/03/16/at-trudeaus-behest-gould-instructed-google-news-to-limit-canadian-access-to-foreign-press/,89,3/20/19 19:25,Trudeau and his gang are nothing like children Children are not boldly duplicitous,-0.166667,0.31450763
30,https://buffalochronicle.com/2019/03/16/at-trudeaus-behest-gould-instructed-google-news-to-limit-canadian-access-to-foreign-press/,90,3/17/19 9:10,We live in very dangerous times When a government decides to manipulate what its people should be allowed to read or watch democracy no longer exists,-0.321818,0.17391942
30,https://buffalochronicle.com/2019/03/16/at-trudeaus-behest-gould-instructed-google-news-to-limit-canadian-access-to-foreign-press/,91,3/22/19 12:03,Demockracy is what we have Representative government never was anything like democracy Editorial policy is quietly set by government  not even journalists are up to speed on the routines of news suppression CBC follows the pattern of the BBC which busily pats itself on the back for journalistic standards Meanwhile I read posts from Biased BBC,0.033333,0.121008664
30,https://buffalochronicle.com/2019/03/16/at-trudeaus-behest-gould-instructed-google-news-to-limit-canadian-access-to-foreign-press/,92,3/17/19 9:51,Thank you for showing up our Governments attempt to keep us in the dark,-0.15,0.13612273
30,https://buffalochronicle.com/2019/03/16/at-trudeaus-behest-gould-instructed-google-news-to-limit-canadian-access-to-foreign-press/,93,3/17/19 9:53,Unfortunately for Justin he just stepped on a land mine laid by his father Pierre Canadians have a constitutional right to the freedoms of belief conscience thought and expression,-0.107143,0.321574
30,https://buffalochronicle.com/2019/03/16/at-trudeaus-behest-gould-instructed-google-news-to-limit-canadian-access-to-foreign-press/,94,3/17/19 10:22,Keep reporting keep exposing the Trudeau government If you had not published this  people in Canada would never know which leads me to wonder what else have they instructed other companies to do in favour of keeping Trudeaus public image from imploding into the truth of the matter Trudeau is a front man only and mindlessly leads by following the instructions of his pmo sycophants,-0.065,0.3921763
30,https://buffalochronicle.com/2019/03/16/at-trudeaus-behest-gould-instructed-google-news-to-limit-canadian-access-to-foreign-press/,95,3/17/19 10:43,Well shortly after winning the election Trudeau had Google remove stories of Harper and his accomplishments That you can look up but probably not through google The head of Stats Can quit after facing pressure from the Liberal government to fudge numbers that would make the Liberal Government look like they have done a better job with the economy then what they have done,0.333333,0.11714657
30,https://buffalochronicle.com/2019/03/16/at-trudeaus-behest-gould-instructed-google-news-to-limit-canadian-access-to-foreign-press/,96,3/17/19 12:19,Wow I did not know about this but not the least surprised Thanks for letting me know I will pass this i fo on,0.025,0.050758693
30,https://buffalochronicle.com/2019/03/16/at-trudeaus-behest-gould-instructed-google-news-to-limit-canadian-access-to-foreign-press/,97,3/18/19 0:05,Also the Paying off of the Clinton Foundation with 20million in taxpayer cash This illustrates the FACT that foreign AND domestic NGOs influence corrupted our last election httpscalgaryheraldcomopiniongwynmorgantalkaboutcollusionhowforeignbackedantioilactivistsinfiltratedcanadasgovernmentwcmf02e7b6f28c24ba8b80b9b29c60387e7,-0.041667,0.22996229
30,https://buffalochronicle.com/2019/03/16/at-trudeaus-behest-gould-instructed-google-news-to-limit-canadian-access-to-foreign-press/,97,3/18/19 0:18,Then theres this donation damn near a quarter billion Canadian taxpayer cash to an obviously corrupt NGO again the Clinton Foundation PLEASE America HELP US httpthemillenniumreportcom201707trudeaugovernmentannounces2415milliondonationtotheclintonfoundationfbclidIwAR2KnN20wSJ19hUqF2EdkncqVG6u8STfIG6p1oIT0ej3XvbrJAFTC2nHI,-0.2,0.59901273
30,https://buffalochronicle.com/2019/03/16/at-trudeaus-behest-gould-instructed-google-news-to-limit-canadian-access-to-foreign-press/,95,3/17/19 10:39,It has become obvious to most that when Trudeau said he admired China He admired Chinas ability to control what its people read hear and believe Trudeau the dictator should be arrested and all his ministers that work against the Old Stock Canadians,0.302083,0.38574582
30,https://buffalochronicle.com/2019/03/16/at-trudeaus-behest-gould-instructed-google-news-to-limit-canadian-access-to-foreign-press/,75,3/17/19 11:08,The double edged sword of the USA is that Ottawas draconian censorship attempts can be avoided by anyone simply advertising in the USA  it still reaches into Canada The bad part is that Ottawas draconian censorship attempts can be avoided by anyone,-0.233333,0.22295564
30,https://buffalochronicle.com/2019/03/16/at-trudeaus-behest-gould-instructed-google-news-to-limit-canadian-access-to-foreign-press/,98,3/17/19 11:21,Thank you so much for this info I was at first confused why someone from Buffalo would be writing about Canadian politics with seemingly unique info to what was reported in the Canadian press I recognized that the info your lavscam related articles showed insight Now it makes sense Please continue with your informative articles to elevate awareness of our currently corrupt government Thanks again,0.017857,0.09029444
30,https://buffalochronicle.com/2019/03/16/at-trudeaus-behest-gould-instructed-google-news-to-limit-canadian-access-to-foreign-press/,2,3/17/19 11:47,Of course she did the current government of canuckistan is nothing more than an organized crime syndicate,0.25,0.32145107
30,https://buffalochronicle.com/2019/03/16/at-trudeaus-behest-gould-instructed-google-news-to-limit-canadian-access-to-foreign-press/,91,3/22/19 12:06,Of course it is What do you think the others are  Search kleptocracy,0,0.22892678
