blogpost_id,url,user,date,text,sentiment,toxicity
30,https://buffalochronicle.com/2019/03/16/at-trudeaus-behest-gould-instructed-google-news-to-limit-canadian-access-to-foreign-press/,99,3/17/19 11:49,I live in Central southern Ontario and I will bookmark the site for further reading Thanks,0.067273,0.055382837
30,https://buffalochronicle.com/2019/03/16/at-trudeaus-behest-gould-instructed-google-news-to-limit-canadian-access-to-foreign-press/,100,3/17/19 12:25,The Americans are doing a better job at reporting our news than we are Thanks for publishing this What a disgraceful state we are in with this Liberal government,0.35,0.44465512
30,https://buffalochronicle.com/2019/03/16/at-trudeaus-behest-gould-instructed-google-news-to-limit-canadian-access-to-foreign-press/,101,3/17/19 12:45,Note Frank Iacobucci is the former Chairman of Torstar and was never a manger there,0,0.23747458
30,https://buffalochronicle.com/2019/03/16/at-trudeaus-behest-gould-instructed-google-news-to-limit-canadian-access-to-foreign-press/,102,3/17/19 12:52,Kudos to the Buffalo crew The Liberals are really getting me concerned Dangerously Stalinesque,-0.2,0.27858937
30,https://buffalochronicle.com/2019/03/16/at-trudeaus-behest-gould-instructed-google-news-to-limit-canadian-access-to-foreign-press/,103,3/17/19 13:38,Oh this is richshut down Canadian access to foreign news platforms and at the same time bump up the propaganda machines in Canada with 600 millionfor our own good as in we get flooded with news in Canada spun to favour Trudeaus reelection campaign What the hell kind of country are we living in Wake up people use your noggins for once in your lives,0.217063,0.32084107
30,https://buffalochronicle.com/2019/03/16/at-trudeaus-behest-gould-instructed-google-news-to-limit-canadian-access-to-foreign-press/,104,3/17/19 15:41,Gould was only trying to accomplish what Adolph Hitler did in Nazi Germany He controlled the press and said that if a lie is repeated enough times many people will believe it Hands up Those who think the carbon tax is a scam If you believe the government TAXTAXTAX is a good plan then you have already swallowed the blue koolaid,0.24,0.37198305
30,https://buffalochronicle.com/2019/03/16/at-trudeaus-behest-gould-instructed-google-news-to-limit-canadian-access-to-foreign-press/,105,3/17/19 18:07,As a result of your publishing this article and making the rounds on social media in Canada  the Chronicle will now be my FIRST daily stop to get news about Canada We cant trust what TURDeau is putting before us He is the Idi Amin of the North,0.094444,0.14069985
30,https://buffalochronicle.com/2019/03/16/at-trudeaus-behest-gould-instructed-google-news-to-limit-canadian-access-to-foreign-press/,106,3/17/19 18:57,Thanks for thisCanada govt long called an iron hand in a velvet glovenow can no longer hide their weak banana republic natureThis id probably just the tip of an iceberg,-0.075,0.25268784
30,https://buffalochronicle.com/2019/03/16/at-trudeaus-behest-gould-instructed-google-news-to-limit-canadian-access-to-foreign-press/,97,3/17/19 23:58,UN Agendas are being implemented in Canada at every level of government UN Agenda 2030 is just a fluffied up version of Agenda 21 for your reading pleasure httpssustainabledevelopmentunorgcontentdocumentsAgenda21pdf,0,0.24101032
30,https://buffalochronicle.com/2019/03/16/at-trudeaus-behest-gould-instructed-google-news-to-limit-canadian-access-to-foreign-press/,107,3/18/19 19:02,Trudeau knows Google can be bought,0,0.049706224
30,https://buffalochronicle.com/2019/03/16/at-trudeaus-behest-gould-instructed-google-news-to-limit-canadian-access-to-foreign-press/,108,3/18/19 21:00,These are dark times in canuckistan castro jr is the perfect foil Hey Look at my colorful socks Hey Lets take a selfie Hey I legalized weed smoke a doobie and leave your cares in a fog Meanwhile he is marching us deeper into the pit and our media fawns over his appearance and tries to persuade us what a genius he is,0.304688,0.30624092
30,https://buffalochronicle.com/2019/03/16/at-trudeaus-behest-gould-instructed-google-news-to-limit-canadian-access-to-foreign-press/,2,3/19/19 23:33,I followed a link placed by Amazing Polly to this Buffalo Chronicle article She covers three stories which are interconnected Her Description 3 stories for you today Operation Varsity Blues dragnet catches big fish including CAA exec 905  Ghoulish Gould asks Google to censor negative stories about SNC Lavalin and the Liberal government 1415  Scumbags in the Liberal Party of Canada drive people to suicide Amazing Polly is must watch as this Gould story is greatly fleshed out is just the preamble to her main story SNC Lavelincultish Liberal caucus  mafia families  Ghaddafis gold ,0.311111,0.3048238
30,https://buffalochronicle.com/2019/03/16/at-trudeaus-behest-gould-instructed-google-news-to-limit-canadian-access-to-foreign-press/,109,3/20/19 18:10,When Trudeau talks about the rule of law what law is he referring too Chinese law,0,0.093587
30,https://buffalochronicle.com/2019/03/16/at-trudeaus-behest-gould-instructed-google-news-to-limit-canadian-access-to-foreign-press/,110,3/20/19 18:18,Excellent article and I will follow your news that puts out what our mobster Government hides from us Thank God we have American press that cares about Canadians and the plight of this deplorable governing body I will share what I see and again WWGWGA GOD BLESS AMERICA AND CANADA my ancestors settled first in NY around 1796 I love NY THANK YOU,0.225,0.21216242
30,https://buffalochronicle.com/2019/03/16/at-trudeaus-behest-gould-instructed-google-news-to-limit-canadian-access-to-foreign-press/,111,3/26/19 21:12,THANK YOU AGAIN Chronicle,0,0.06588418
30,https://buffalochronicle.com/2019/03/16/at-trudeaus-behest-gould-instructed-google-news-to-limit-canadian-access-to-foreign-press/,112,3/30/19 10:35,I just was reading just now and this is what trudo does to Canadians He does not care what WE as Canadians think Most of the majority of Canadians and I are voting Turdo out on OCT 21 We as Canadians cant let trudo dictate us,0.5,0.100614615
30,https://buffalochronicle.com/2019/03/16/at-trudeaus-behest-gould-instructed-google-news-to-limit-canadian-access-to-foreign-press/,113,4/11/19 16:27,Control the media and you control the masses Goebels knew that all too well,0,0.10189823
30,https://buffalochronicle.com/2019/03/16/at-trudeaus-behest-gould-instructed-google-news-to-limit-canadian-access-to-foreign-press/,48,10/9/19 22:09,So much for free speech liberal losers,0.116667,0.85403657
31,https://buffalochronicle.com/2019/03/18/ottawa-political-operative-threatens-conservative-publisher-with-fake-news-in-the-globe-and-mail/,2,3/18/19 10:34,FAKE FUCKING NEWS IDIOTS,-0.633333,0.9798764
31,https://buffalochronicle.com/2019/03/18/ottawa-political-operative-threatens-conservative-publisher-with-fake-news-in-the-globe-and-mail/,114,3/19/19 13:08,Dont be so hard on Mr Ling Hes just bowing to his political masters,-0.145833,0.2528693
31,https://buffalochronicle.com/2019/03/18/ottawa-political-operative-threatens-conservative-publisher-with-fake-news-in-the-globe-and-mail/,115,3/18/19 11:59,Absolutely love it thank you Matthew Ricchiazzi and the Buffalo Chronicle for pointing out the hypocrisy of Canadian media saying they are journalists and reporters and willing to take taxpayers money to supply their version of the news Until the Buffalo Chronicle reported on the Bank of Montreals conduct in the TransMountain expansion I really was surprised how quickly and decisively purchased the pipeline from Kinder Morgan Thanks to your work it is all making sense,0.263889,0.21869202
31,https://buffalochronicle.com/2019/03/18/ottawa-political-operative-threatens-conservative-publisher-with-fake-news-in-the-globe-and-mail/,2,3/19/19 11:45,hypocrisy of Canadian media saying they are journalists and reporters and willing to take taxpayers money to supply their version of the news Good thing theres no American equivalent eh Oh wait The SmithMundt Modernization Act of 2012 which was contained within the National Defense Authorization Act for Fiscal Year 2013 section 1078 a amended the United States Information and Educational Exchange Act of 1948 and the Foreign Relations Authorization Act of 1987 allowing for materials produced by the State Department and the Broadcasting Board of Governors BBG to be available within the United States,0.245833,0.24649152
31,https://buffalochronicle.com/2019/03/18/ottawa-political-operative-threatens-conservative-publisher-with-fake-news-in-the-globe-and-mail/,115,3/19/19 16:39,Nice try there whoever you are but that legislation doesnt apply to the Buffalo Chronicle Keep trying though youre doing ok and thats what counts in Canada,0.55,0.07180084
31,https://buffalochronicle.com/2019/03/18/ottawa-political-operative-threatens-conservative-publisher-with-fake-news-in-the-globe-and-mail/,116,3/18/19 15:01,You guys are nuts There is no direction or control from the government to gain those subsidies The subsidies are there to protect and stabilize our print media so that Canadians can continue to rely on an independant and free press Canadian journalists enjoy the same freedoms and rights as their American counterparts You are way out to lunch on this story I dont use the term Fake News ever but I am prepared to use that term with respect to your publication,0.06,0.4291382
31,https://buffalochronicle.com/2019/03/18/ottawa-political-operative-threatens-conservative-publisher-with-fake-news-in-the-globe-and-mail/,117,3/18/19 21:18,Umm its actually YOU who is nuts honey,0,0.4060709
31,https://buffalochronicle.com/2019/03/18/ottawa-political-operative-threatens-conservative-publisher-with-fake-news-in-the-globe-and-mail/,118,3/19/19 9:47,Get your head out of the sand He who has the Gold makes the Rules,0,0.3216559
31,https://buffalochronicle.com/2019/03/18/ottawa-political-operative-threatens-conservative-publisher-with-fake-news-in-the-globe-and-mail/,115,3/19/19 16:37,So the Liberal government just purchased the TransMountain pipeline out of the goodness of their hearts and love of Albertans Whos the nutjob again,0.5,0.45408118
31,https://buffalochronicle.com/2019/03/18/ottawa-political-operative-threatens-conservative-publisher-with-fake-news-in-the-globe-and-mail/,119,3/19/19 18:03,This Canadian begs to differ AD There is plenty of control being brought forth by our corrupt Liberal Government Used to just be control over the CBC now its everywhere thanks to Turdo and his pay for news scheme,-0.15,0.36246994
31,https://buffalochronicle.com/2019/03/18/ottawa-political-operative-threatens-conservative-publisher-with-fake-news-in-the-globe-and-mail/,120,3/21/19 13:16,Another brain dead Trudeau Supporter has her sayget real my child the LIBS OWN the MSM600 Million will do that,0.2,0.46589994
31,https://buffalochronicle.com/2019/03/18/ottawa-political-operative-threatens-conservative-publisher-with-fake-news-in-the-globe-and-mail/,121,3/24/19 10:34,You have gorged on KoolAid Lady You are a fool if you actually believe that horse shit you have posted,-0.1,0.960928
31,https://buffalochronicle.com/2019/03/18/ottawa-political-operative-threatens-conservative-publisher-with-fake-news-in-the-globe-and-mail/,68,3/24/19 10:50,Do you really understand the meaning of the word INDEPENDENT Taking Juthtins PAYOFFS means they will do the bidding of the Briberals They are turning this country into a third world republic the Briberals must be thrown out of office,0.066667,0.38924268
31,https://buffalochronicle.com/2019/03/18/ottawa-political-operative-threatens-conservative-publisher-with-fake-news-in-the-globe-and-mail/,122,3/25/19 14:58,oh youre funny  wait what Youre serious Oh dear ,-0.041667,0.19251408
31,https://buffalochronicle.com/2019/03/18/ottawa-political-operative-threatens-conservative-publisher-with-fake-news-in-the-globe-and-mail/,111,3/26/19 18:35,Youre the one who is nuts A D How can you be independent when you are subsidized by the government Grow up,0,0.7620331
31,https://buffalochronicle.com/2019/03/18/ottawa-political-operative-threatens-conservative-publisher-with-fake-news-in-the-globe-and-mail/,123,3/19/19 1:18,AD is part of the Liberal see no evil group of which JT is the Grand Master JT is the,0.5,0.31737366
31,https://buffalochronicle.com/2019/03/18/ottawa-political-operative-threatens-conservative-publisher-with-fake-news-in-the-globe-and-mail/,2,3/21/19 14:04,Thank you for standing up to this guys bully tactics Most of my fellow Canucks have their heads in the sand about how corrupt our Government is We are slowly turning into the Peoples Republic of Canada The State is slowly taking over all aspects of Canadian society,-0.15,0.4432752
31,https://buffalochronicle.com/2019/03/18/ottawa-political-operative-threatens-conservative-publisher-with-fake-news-in-the-globe-and-mail/,124,3/22/19 17:26,Its a big sandbox Why cant we all just play nice,0.3,0.045911934
31,https://buffalochronicle.com/2019/03/18/ottawa-political-operative-threatens-conservative-publisher-with-fake-news-in-the-globe-and-mail/,125,3/24/19 2:34,Not surprising in the least is the tone of the State sponsored journalist Ling it has a real fascistic ring to it doesnt it demanding to know where the Chronicle is getting its information fromincluding the names of the non State sponsored journalists wow it tells you all you need to know regarding the state of Canadian journalism these days Its a far left circle jerk with a hint of totalitarianism Ling is a disgrace to the journalistic practice I wish I could say Ling was some fringe weirdo sadly he is representative of many of far leftist agitators disguised as journalists in Canada Ling is a prime example of what the death of journalism looks like and in Canada he has a lot of competition,-0.02,0.52596474
31,https://buffalochronicle.com/2019/03/18/ottawa-political-operative-threatens-conservative-publisher-with-fake-news-in-the-globe-and-mail/,126,3/24/19 7:38,When you elect an elementary drama teacher expect childish drama,0.3,0.43986315
31,https://buffalochronicle.com/2019/03/18/ottawa-political-operative-threatens-conservative-publisher-with-fake-news-in-the-globe-and-mail/,127,3/24/19 10:19,I had not heard about the Buffalo Chronicle publication until I read Mr Lings article You guys have great articles well researched and writtten I will share the link with my friends Thanks again Mr Ling,0.625,0.058162544
31,https://buffalochronicle.com/2019/03/18/ottawa-political-operative-threatens-conservative-publisher-with-fake-news-in-the-globe-and-mail/,122,3/25/19 15:01,Exactly More people are learning about the Chronicle thanks to goofballs like this Ling dolt moaning and dripping about it that a simple google search ever would thanks to their slanted algorithms The team at the Chronicle should send a small token of their appreciation for his efforts at expanding their reach within Canada,0.1275,0.3220518
31,https://buffalochronicle.com/2019/03/18/ottawa-political-operative-threatens-conservative-publisher-with-fake-news-in-the-globe-and-mail/,121,3/24/19 10:39,Government must NOT subsidized media That will distort their role in scrutinizing government An idiot can see that Canadians are dumber than idiots because they elected this retarded son of a destructive Canadian communist who was PM for about 18 horrid years The asshole who is currently the PM must be gotten rid of,-0.6,0.94864124
31,https://buffalochronicle.com/2019/03/18/ottawa-political-operative-threatens-conservative-publisher-with-fake-news-in-the-globe-and-mail/,111,3/26/19 18:32,THANK YOU Buffalo Chronicle You are a beacon of hope,0,0.121728934
32,https://buffalochronicle.com/2019/03/22/bmos-kevin-lynch-threatened-job-losses-in-call-to-wernick/,128,3/29/19 4:26,what a pile of crooks where are the RCMP they all should go to jail for ripping of the taxpayer That why trudeau does not want Jody Wilson Raybould to speak Scott is up to his eye ball in this shit The RCMP should put a hold on all their bank accounts and their trust funds its all taxpayers money Jody should be given full power to talk and bury them all Thats why all the rats are leaving,0.016667,0.8935987
32,https://buffalochronicle.com/2019/03/22/bmos-kevin-lynch-threatened-job-losses-in-call-to-wernick/,129,4/2/19 10:08,Ive been trying to get someone in Canada to see that we are NOT following the aswritten BNAConstitution of 1867 and this is the BIGGEST of the problems but no one sees it The Clerk of the s11 Privy Council is part of the Executive Power which reports to the s12 Governor General who was intended to look out for the best interests of the Crownnow the public In 1940 during a wartime emergency an Order in Council PC19401121 merged  seconded usurped the office of Secretary to the Cabinet Legislative Power WITH the office of Clerk of the Privy Council Executive Imagine merging the office of USA President with Speaker of the Combined House  Senate  too much power in one place Google PC19401121 and some of my posts posts etc will pop up plus my diagrams and the Order itself I hope this interests you Its so big no one here except one chap in Nova Scotia and one in Manitoba a can see it b appreciates what it means and c thinks I can do anything about it Robert Ede 4168197333,0.216667,0.16830921
32,https://buffalochronicle.com/2019/03/22/bmos-kevin-lynch-threatened-job-losses-in-call-to-wernick/,130,4/5/19 8:42,Thank you for your research Uncle Bob As an Ottawan I am deeply disturbed that all this corruption just seems to be par for the course The more troubling thing is this in house lawyer for SNC in the room when all is discussed These are the days when all will be revealed BTW is the chap in NS a certain Billy Joyce Sincerely R Moore,0.303571,0.23539306
32,https://buffalochronicle.com/2019/03/22/bmos-kevin-lynch-threatened-job-losses-in-call-to-wernick/,129,4/5/19 9:20,Sorry in NS its Fred who runs the YouTube channel CrossCanadaNewscom,-0.5,0.090412535
32,https://buffalochronicle.com/2019/03/22/bmos-kevin-lynch-threatened-job-losses-in-call-to-wernick/,131,10/8/19 11:28,Why under same foreign policy act is not mentioned HALLIBURTON with office in Calgary in my job while I was sleeping out of my tower they falsified the surveys reported to customer myself next in the morning when to take over I discovered intentional fault being a professional honest Canadian hired by HALLIBURTON in Calgary I reported the false HALLIBURTON lost that job was banned work 3 years for that customer and it happened in the last 10 years second time under same CEO Dave Lesar collecting 183 million salary yearly the two falsifiers being Khaled Saad DD Manager and Tarek Khattab Country manager both sons in law of Mahmoud ElKhady Region manager were accommodated in different positions and to me thru Calgary office  in a moment when they were hiring to cover their dirt they Reduced In Force coming with dirty money  which I never touched  under condition do not sue them in CANADA case S 2017060104 registered at Alberta Human Rights commission where corrupted decision makers John Gabrielle with friends in corrupted lawyers firm NORTON ROSE FULBRIGHT  they twisted every thing thats why I cannot trust any politicians in election campaign and in VOTE DAY I will be in hunger strike till HR justice system will be one of their priority in that year I made 275 K I was taxed 90K in my last 2 decades of career working overseas from plus 56 deg C to minus 55 deg C 8 to 9 months yearly I brought in CANADA millions of dollars and still I am discriminated in employment and much more  like in 1993 I was agresses I paid a Lawyer Me Francois Gottlieb to sue the aggressor case 50005009147941 and we did contract on another 40 on collection he did nothing 17 years and after the Quebec Lawyers association advised me do ont sue the lawyers for professional mistake which I did it and I lost case 50017016803036 due to morally corrupted judges Dion Belanger Nadeau Benoit Morin Rene Dusault and Yves Marie Morissette I contacted again le Barreau and they told me again to re open the case I invested 43K open the cause wining but when to collect after 23 years due to Gottileb I got zero with help lawyers the guilty hiding his belongs  I will go public and I will do hunger strike to protest peaceful  LIVIU POPESCU MONTREAL QUEBEC,-0.019444,0.2136468
34,https://buffalochronicle.com/2019/03/26/snc-lavalin-ceos-wife-employed-by-stephen-bronfman-to-leave-canada-imminently/,132,3/26/19 16:48,Wonder if Clare Bronfmans arrest in the NXIVM cult case overlaps into this need to get get out of Canada situation,-0.05,0.11100713
34,https://buffalochronicle.com/2019/03/26/snc-lavalin-ceos-wife-employed-by-stephen-bronfman-to-leave-canada-imminently/,133,3/31/19 0:11,With each passing day another loose thread is made visible for the pullingClare Bronfman is connected to the NXIVM cult case wow lets keep pulling on that thread Im curious as to the those ties that bind,-0.025641,0.08694499
34,https://buffalochronicle.com/2019/03/26/snc-lavalin-ceos-wife-employed-by-stephen-bronfman-to-leave-canada-imminently/,134,10/15/19 13:19,Has anyone tried sharing this on Facebook They would not let me because they say Others have reported this as abusive,0,0.12187651
1,https://buffalochronicle.com/2019/04/02/chrystia-freeland-is-angling-to-succeed-trudeau-as-prime-minister/,135,4/2/19 12:01,So the Bronfmans are going to pick our next PM  think again the Liberals are gone gone gone  for good this time  too much corruption and far too much unCanadian behavior  arrogance elitism cronyism and money  Canadians just want a government to do right by the people all the people and Trudeau and his gang blew it,0.247619,0.47744283
1,https://buffalochronicle.com/2019/04/02/chrystia-freeland-is-angling-to-succeed-trudeau-as-prime-minister/,61,4/2/19 17:14,And the carbon tax has hit the one province whose bad side no candidate without a death wish wants to be on,-0.25,0.20335238
1,https://buffalochronicle.com/2019/04/02/chrystia-freeland-is-angling-to-succeed-trudeau-as-prime-minister/,111,4/2/19 21:24,Corruption for over a century,0,0.23660788
1,https://buffalochronicle.com/2019/04/02/chrystia-freeland-is-angling-to-succeed-trudeau-as-prime-minister/,136,4/3/19 13:48,This article is hogwash and Trudeau is going nowhere lol except back to Parliament as the Prime Minister,0.4,0.4278847
1,https://buffalochronicle.com/2019/04/02/chrystia-freeland-is-angling-to-succeed-trudeau-as-prime-minister/,56,4/3/19 20:18,That well may be but as the worst Prime Minister throughout history bar none,-1,0.28282678
1,https://buffalochronicle.com/2019/04/02/chrystia-freeland-is-angling-to-succeed-trudeau-as-prime-minister/,137,4/4/19 0:32,Hey Patttyy Can you please give us an idea how low Jr will go to retain the highest office in the land Some say he is very close to his most favoured nation That being China Apparently achieving at depth with in weeks,0.1875,0.27770835
1,https://buffalochronicle.com/2019/04/02/chrystia-freeland-is-angling-to-succeed-trudeau-as-prime-minister/,138,5/14/19 9:43,Get real worst PM in history,-1,0.3764946
1,https://buffalochronicle.com/2019/04/02/chrystia-freeland-is-angling-to-succeed-trudeau-as-prime-minister/,56,5/14/19 11:33,I would be surprised if this was true as for Trudeau going I certainly hope so but any minute now he is going to start spraying goodies around in hopes of hitting everyone and causing them to once again vote Liberal I hope and pray that I am wrong If the Libs were paying attention they would realize that assurance of reelection would come with a leadership convention I believe that a Border Collie in a three piece suit could beat the current loser,0.032857,0.28241354
1,https://buffalochronicle.com/2019/04/02/chrystia-freeland-is-angling-to-succeed-trudeau-as-prime-minister/,139,8/4/19 10:11,Youre dreaming Patsy Trudeau is the most hated Politician Canada ever put forward he and his 40 Robbers are history coming October 2019 ,-0.25,0.7143426
1,https://buffalochronicle.com/2019/04/02/chrystia-freeland-is-angling-to-succeed-trudeau-as-prime-minister/,2,5/16/19 16:56,Gone for good until we get tired of Conservative corruption Then we are back to corruption Liberal flavor ,0.1,0.3716405
1,https://buffalochronicle.com/2019/04/02/chrystia-freeland-is-angling-to-succeed-trudeau-as-prime-minister/,140,4/2/19 12:27,Next to Trudeau Chrystia Freeland is the second most disliked person in Canada I dont think so Try Jody WilsonRaybould,-0.125,0.78364515
1,https://buffalochronicle.com/2019/04/02/chrystia-freeland-is-angling-to-succeed-trudeau-as-prime-minister/,2,4/2/19 14:52,Who are you trying to kid  Jody WilsonRaybould is one of the most honest women in politics and most likely you are liberal that is why you posted what you did She stood up for what is right and is being throw under the bus for it  Chrystia Freeland is just a sheep in the herd belonging to Trudeau ,0.377143,0.4051286
1,https://buffalochronicle.com/2019/04/02/chrystia-freeland-is-angling-to-succeed-trudeau-as-prime-minister/,2,4/2/19 18:56,Shes a fukn rat liberal that got off the boat before it sankshe voted with all the other rats to destroy Canada,-0.1625,0.9030623
